{
  "schema_version": "3.0",
  "snapshot_version": "1.0",
  "snapshot_id": "snapshot-001",
  "result_id": "result-001",
  "observed_at": "2026-07-31T10:00:00Z",
  "support": {
    "state": "pass",
    "ood_state": "in_distribution",
    "probability_calibrated": 0.97
  },
  "localization": {
    "state": "pass",
    "label_region": {
      "x": 0.1,
      "y": 0.2,
      "width": 0.8,
      "height": 0.6
    },
    "text_region": {
      "x": 0.2,
      "y": 0.3,
      "width": 0.5,
      "height": 0.2
    },
    "text_containment": 0.98,
    "label_confidence": 0.96
  },
  "quality": {
    "crop": {
      "state": "pass"
    },
    "scale": {
      "state": "pass"
    },
    "center": {
      "state": "pass"
    },
    "blur": {
      "state": "pass"
    },
    "exposure": {
      "state": "pass"
    },
    "contrast": {
      "state": "pass"
    },
    "glare": {
      "state": "pass"
    },
    "occlusion": {
      "state": "pass"
    },
    "perspective": {
      "state": "pass"
    },
    "ocr_integrity": {
      "state": "pass"
    },
    "overall": {
      "state": "pass"
    }
  },
  "ocr": {
    "raw_string": "00A-17/9",
    "displayed_string": "00A-17/9",
    "whole_string_exact_probability_calibrated": 0.83,
    "format_warning": null,
    "checksum_warning": null,
    "silent_repair_applied": false,
    "candidate_mutated": false
  },
  "freshness": {
    "is_current_attempt": true,
    "age_ms": 10,
    "max_age_ms": 30000
  },
  "versions": {
    "model": "model-id",
    "preprocess": "prep-id",
    "calibration": "cal-id",
    "schema": "3.0",
    "policy_compatible": "policy-id",
    "threshold_compatible": "auto-exact-pet-v1"
  }
}
